{
  "schema_version": "0.1.0",
  "titulo": "Ciclo XXVI — Portomonte sob revisão: escolhas sem coroação",
  "estado": "pauta_editorial_pendente",
  "regiao_id": "regiao:costa-sul",
  "assentamento_id": "assentamento:portomonte",
  "fonte_matriz": "data/worldbuilding/portomonte-templo-governo-ciclo25.json",
  "aprovacao_autoral": false,
  "mutacao_canonica_automatica": false,
  "modelo_governo_aprovado": null,
  "agua_potavel_aprovada": null,
  "operacao_ritual_aprovada": null,
  "alterou_atlas": false,
  "alterou_criaturas": false,
  "alterou_regras_dw": false,
  "politica_de_aprovacao": {
    "condicao": "Somente uma manifestação explícita do autor sobre decisão específica, com formulação aprovada, pode abrir um ciclo posterior de integração no atlas.",
    "proveniencia_exigida": [
      "id_da_decisao",
      "texto_da_decisao_autoral",
      "identificacao_da_fonte_autoral",
      "revisao_das_dependencias",
      "revisao_dos_impactos",
      "novos_testes_de_regressao"
    ],
    "silencio_significa_aprovacao": false,
    "consulta_aplica_alteracao": false,
    "simulacao_aplica_alteracao": false
  },
  "etapas_de_revisao": [
    {
      "id": "worldbuilding-xxvi:etapa:fonte",
      "nome": "Revisão de fonte e lacuna",
      "escopo": "Confirmar fatos já estabelecidos e lacunas de água, governo e quantidades.",
      "decisoes": [],
      "concluida": false,
      "aprovacao_autoral": false
    },
    {
      "id": "worldbuilding-xxvi:etapa:autoridade",
      "nome": "Arquitetura de poder",
      "escopo": "Discutir autoridade, templo, distribuição e responsabilidade sem votar automaticamente.",
      "decisoes": [
        "worldbuilding-xxvi:decisao:autoridade",
        "worldbuilding-xxvi:decisao:templo",
        "worldbuilding-xxvi:decisao:distribuicao",
        "worldbuilding-xxvi:decisao:responsabilidade"
      ],
      "concluida": false,
      "aprovacao_autoral": false
    },
    {
      "id": "worldbuilding-xxvi:etapa:ritual",
      "nome": "Vida material e trabalho",
      "escopo": "Discutir potabilidade, executantes, mecanismo, continuidade, auxiliares, cultivo e meios.",
      "decisoes": [
        "worldbuilding-xxvi:decisao:agua-domestica",
        "worldbuilding-xxvi:decisao:responsaveis-rito",
        "worldbuilding-xxvi:decisao:mecanismo",
        "worldbuilding-xxvi:decisao:continuidade",
        "worldbuilding-xxvi:decisao:auxiliares",
        "worldbuilding-xxvi:decisao:cultivo",
        "worldbuilding-xxvi:decisao:instrumentos"
      ],
      "concluida": false,
      "aprovacao_autoral": false
    },
    {
      "id": "worldbuilding-xxvi:etapa:integracao",
      "nome": "Integração futura, não nesta revisão",
      "escopo": "Revisar comércio, dependências de decisão e impactos antes de eventual nova proposta de alteração canônica.",
      "decisoes": [
        "worldbuilding-xxvi:decisao:comercio"
      ],
      "concluida": false,
      "aprovacao_autoral": false
    }
  ],
  "decisoes": [
    {
      "id": "worldbuilding-xxvi:decisao:autoridade",
      "ordem_editorial": 1,
      "dominio": "autoridade",
      "prioridade": "critica",
      "pergunta": "Quem toma decisões civis em Portomonte, e como são contestadas?",
      "origem_pergunta_id": "worldbuilding-xxv:pergunta:autoridade",
      "referencias_de_proposta": [
        "worldbuilding-xxv:modelos_de_governo:casas-e-oficios",
        "worldbuilding-xxv:modelos_de_governo:conselho-revogavel",
        "worldbuilding-xxv:modelos_de_governo:templo-consultivo",
        "worldbuilding-xxv:modelos_de_governo:pactos-entre-vizinhos"
      ],
      "depende_de": [],
      "nota_dependencias": "Dependência de sequência editorial e cruzamento de consequências; não presume causalidade canônica ou proibição de discussão em outra ordem.",
      "opcoes": [
        {
          "id": "worldbuilding-xxvi:opcao:autoridade:casas",
          "rotulo": "Assembleia de casas e ofícios",
          "formulacao_autoral_possivel": "Poder civil distribuído entre representantes de moradores e trabalhadores, sujeitos a contestação.",
          "risco_da_escolha": "Representatividade pode excluir quem não possui oficina ou casa.",
          "modelo_xxv_id": "worldbuilding-xxv:modelos_de_governo:casas-e-oficios",
          "estado": "candidata_nao_adotada",
          "aprovacao_autoral": false,
          "canon_aplicado": false
        },
        {
          "id": "worldbuilding-xxvi:opcao:autoridade:conselho",
          "rotulo": "Conselho temporário revogável",
          "formulacao_autoral_possivel": "Coordenação civil restrita a necessidades, com fim de mandato definido pelo autor.",
          "risco_da_escolha": "Emergência tende a prolongar poderes.",
          "modelo_xxv_id": "worldbuilding-xxv:modelos_de_governo:conselho-revogavel",
          "estado": "candidata_nao_adotada",
          "aprovacao_autoral": false,
          "canon_aplicado": false
        },
        {
          "id": "worldbuilding-xxvi:opcao:autoridade:templo-consultivo",
          "rotulo": "Templo consultado, decisão civil",
          "formulacao_autoral_possivel": "Rito e conselho se relacionariam sem transferir automaticamente a soberania.",
          "risco_da_escolha": "Parecer técnico pode virar veto político.",
          "modelo_xxv_id": "worldbuilding-xxv:modelos_de_governo:templo-consultivo",
          "estado": "candidata_nao_adotada",
          "aprovacao_autoral": false,
          "canon_aplicado": false
        },
        {
          "id": "worldbuilding-xxvi:opcao:autoridade:pactos",
          "rotulo": "Pactos entre núcleos",
          "formulacao_autoral_possivel": "Autoridade civil plural por acordos voluntários, sem centro definido de antemão.",
          "risco_da_escolha": "Desigualdade de força pode tornar um pacto coercitivo.",
          "modelo_xxv_id": "worldbuilding-xxv:modelos_de_governo:pactos-entre-vizinhos",
          "estado": "candidata_nao_adotada",
          "aprovacao_autoral": false,
          "canon_aplicado": false
        },
        {
          "id": "worldbuilding-xxvi:opcao:autoridade:outro",
          "rotulo": "Modelo próprio ou ainda desconhecido",
          "formulacao_autoral_possivel": "O autor pode propor uma quinta arquitetura ou manter a questão aberta.",
          "risco_da_escolha": "Não deduzir instituições a partir da importância do templo.",
          "modelo_xxv_id": null,
          "estado": "candidata_nao_adotada",
          "aprovacao_autoral": false,
          "canon_aplicado": false
        }
      ],
      "estado": "aguarda_decisao_expressa",
      "opcao_escolhida_id": null,
      "texto_autoral_aprovado": null,
      "fonte_da_aprovacao": null,
      "data_da_aprovacao": null,
      "aprovacao_autoral": false,
      "canon_aplicado": false
    },
    {
      "id": "worldbuilding-xxvi:decisao:templo",
      "ordem_editorial": 2,
      "dominio": "templo",
      "prioridade": "critica",
      "pergunta": "O templo de Deméter possui poder político formal ou apenas autoridade ritual?",
      "origem_pergunta_id": "worldbuilding-xxv:pergunta:templo",
      "referencias_de_proposta": [
        "worldbuilding-xxv:relacoes_sociais:sacerdotes",
        "worldbuilding-xxv:relacoes_sociais:lavradores",
        "worldbuilding-xxv:garantias_civis:testemunho",
        "worldbuilding-xxv:garantias_civis:recusa"
      ],
      "depende_de": [
        "worldbuilding-xxvi:decisao:autoridade"
      ],
      "nota_dependencias": "Dependência de sequência editorial e cruzamento de consequências; não presume causalidade canônica ou proibição de discussão em outra ordem.",
      "opcoes": [
        {
          "id": "worldbuilding-xxvi:opcao:templo:autonomia-ritual",
          "rotulo": "Autonomia ritual sem poder civil",
          "formulacao_autoral_possivel": "O templo decide apenas assuntos internos do culto; distribuição e lei seguiriam outra autoridade escolhida.",
          "risco_da_escolha": "Precisaria definir onde acaba competência ritual.",
          "modelo_xxv_id": null,
          "estado": "candidata_nao_adotada",
          "aprovacao_autoral": false,
          "canon_aplicado": false
        },
        {
          "id": "worldbuilding-xxvi:opcao:templo:vinculo-civil",
          "rotulo": "Autoridade religiosa e civil vinculadas",
          "formulacao_autoral_possivel": "O autor poderia definir um vínculo institucional específico.",
          "risco_da_escolha": "O vínculo pode gerar coação de fé e alimentação.",
          "modelo_xxv_id": null,
          "estado": "candidata_nao_adotada",
          "aprovacao_autoral": false,
          "canon_aplicado": false
        },
        {
          "id": "worldbuilding-xxvi:opcao:templo:poder-informal",
          "rotulo": "Prestígio sem título político",
          "formulacao_autoral_possivel": "Influência social forte, ainda que sem cargo formal de governo.",
          "risco_da_escolha": "Decisões podem ser controladas sem responsabilidade pública.",
          "modelo_xxv_id": null,
          "estado": "candidata_nao_adotada",
          "aprovacao_autoral": false,
          "canon_aplicado": false
        }
      ],
      "estado": "aguarda_decisao_expressa",
      "opcao_escolhida_id": null,
      "texto_autoral_aprovado": null,
      "fonte_da_aprovacao": null,
      "data_da_aprovacao": null,
      "aprovacao_autoral": false,
      "canon_aplicado": false
    },
    {
      "id": "worldbuilding-xxvi:decisao:agua-domestica",
      "ordem_editorial": 3,
      "dominio": "agua-domestica",
      "prioridade": "critica",
      "pergunta": "A água purificada do Mar de Sangue é adequada para beber?",
      "origem_pergunta_id": "worldbuilding-xxv:pergunta:agua-domestica",
      "referencias_de_proposta": [
        "worldbuilding-xxv:etapas_de_trabalho:proveniencia",
        "worldbuilding-xxv:etapas_de_trabalho:rito",
        "worldbuilding-xxv:dilemas:colheita-futura",
        "worldbuilding-xxv:dilemas:agua-impropria"
      ],
      "depende_de": [],